{
  "id": "CHG-20260810-078",
  "title": "Formal Whole-Book V2 UI cutover",
  "type": "feature",
  "base_version": "1.2.0",
  "status": "verified",
  "include_in_next_release": true,
  "commits": [
    {
      "sha": "133490105f40694f1f07411a7fe266a77876e9eb",
      "message": "cut over formal Whole-Book product UI to shared V2 and hierarchical runtime.",
      "primary": true,
      "multi_change_reason": null
    }
  ],
  "modules": [
    "apps/api",
    "apps/desktop"
  ],
  "files": [],
  "user_summary": "Formal Whole-Book V2 UI cutover with shared ReportView and hierarchical V2 formal runtime.",
  "technical_summary": "Route /books/:bookId/whole-book -> WholeBookV2ProductPage; Free create/background use hierarchical V2; legacy V1 notice.",
  "acceptance_criteria": [],
  "tests": [
    "tests/test_whole_book_chg078_formal_v2_cutover.py",
    "apps/desktop/src/features/wholeBookV2/WholeBookV2ProductPage.test.tsx",
    "apps/desktop/src/features/wholeBookV2/WholeBookV2ReportView.test.tsx"
  ],
  "verification_evidence": [
    "release/evidence/whole-book/CHG-20260810-078/"
  ],
  "data_compatibility": {
    "database_changed": false,
    "migration_required": false,
    "user_data_compatible": true,
    "notes": ""
  },
  "release_impact": {
    "requires_reanalysis": true,
    "requires_restart": true,
    "updater_impact": false,
    "breaking_change": false
  },
  "blocker_level": null,
  "head_inclusion": "INCLUDED",
  "created_at": "2026-08-10T07:16:03Z",
  "updated_at": "2026-08-10T07:42:37Z"
}
