{
  "id": "CHG-20260724-057",
  "title": "BookOverview Provider Output Contract Enforcement",
  "type": "fix",
  "base_version": "1.0.5",
  "status": "tested",
  "include_in_next_release": true,
  "commits": [
    {
      "sha": "285cae8fa5b5c73a1b1574b9ef3f20fc8571d613",
      "message": "docs: finalize CHG-20260724-057 tested status",
      "primary": true,
      "multi_change_reason": "Integration cherry-pick retarget"
    },
    {
      "sha": "49fcd1d9dba3f37fd66b7e663a2bf671da6546fd",
      "message": "fix: consume validated book overview module results",
      "primary": true,
      "multi_change_reason": null
    },
    {
      "sha": "85d904bf1346dae52d1b00b4e65470e4aaf2bb35",
      "message": "docs: retarget CHG-20260724-057 commits to Integration SHAs",
      "primary": true,
      "multi_change_reason": null
    },
    {
      "sha": "c1735d4af44135acc59161022d10e445334e0433",
      "message": "docs: retarget CHG-20260724-057 commits to Integration SHAs",
      "primary": true,
      "multi_change_reason": null
    }
  ],
  "modules": [
    "narrative_core",
    "private_engine_lab"
  ],
  "files": [
    "apps/api/app/narrative_core/services/book_overview_output_contract.py",
    "apps/api/app/narrative_core/services/whole_book_provider_gateway.py",
    "scripts/check_public_provider_boundary.py"
  ],
  "user_summary": "Enforce flat BookOverviewResultDto; reject undeclared wrappers/evidence_map; allow one budgeted schema repair.",
  "technical_summary": "Enforce flat BookOverviewResultDto as sole provider output. Exact top-level reject for book_overview/evidence_map/synthetic wrappers; DTO-generated JSON Schema; one budgeted schema repair; Public boundary scan; FakeHttp HTTP replay fixtures; Estimate repair cost fields; reference null/empty rules for book_overview-only.",
  "acceptance_criteria": [
    "Flat DTO HTTP replay succeeds with repair_count=0; envelope triggers one repair then succeeds; repair failure fail-closed; evidence_map never parsed; Public boundary check passes."
  ],
  "tests": [
    "apps/api/tests/test_narrative_phase2br1_http_replay_no_repair.py",
    "apps/api/tests/test_public_provider_boundary.py"
  ],
  "verification_evidence": [
    "retry5/run_id=1 retained read-only as undeclared wrapper evidence; Private HEAD 17491525e11095aaa733b18baf0b91527f352446",
    "Public Fix a2c0ec417cea7af0e9ec1460618d5d092b99e92c + 2cf6999; Private Fix 17491525e11095aaa733b18baf0b91527f352446; HTTP replay no-repair/single-repair/repair-failed passed; Public boundary OK; check_project/version/capability passed; VERSION=1.0.5; no Migration; no real Bailian."
  ],
  "data_compatibility": {
    "database_changed": false,
    "migration_required": false,
    "user_data_compatible": true,
    "notes": "No Migration. Undeclared provider envelopes are rejected (no evidence_map contract)."
  },
  "release_impact": {
    "requires_reanalysis": false,
    "requires_restart": true,
    "updater_impact": false,
    "breaking_change": false
  },
  "blocker_level": null,
  "head_inclusion": "INCLUDED",
  "created_at": "2026-07-24T13:06:00Z",
  "updated_at": "2026-07-24T13:26:57Z"
}
