{
  "id": "CHG-20260727-021",
  "title": "StoryLens 1.1.1 RC1 packaging and installed verification",
  "type": "build",
  "base_version": "1.1.0",
  "status": "verified",
  "include_in_next_release": true,
  "commits": [
    {
      "sha": "0229c29713ed0f77e79a6a32f61789c29043163e",
      "message": "chore(release): prepare StoryLens 1.1.1-rc.1",
      "primary": true,
      "multi_change_reason": null
    },
    {
      "sha": "e373ed2e25d7b32d3c06689d637a17958a89797c",
      "message": "fix(release): align RC1 gate tests with CHG-019 chapter CTA",
      "primary": true,
      "multi_change_reason": null
    },
    {
      "sha": "a51459e84c4e83b68ca92bb7bb105683d93223a6",
      "message": "docs(release): record 1.1.1-rc.1 final HEAD in evidence report",
      "primary": true,
      "multi_change_reason": null
    },
    {
      "sha": "270353ee8f071d2dec4e22790bdf35476d5ddce6",
      "message": "docs(release): record corrected 1.1.1-rc.1 final HEAD",
      "primary": true,
      "multi_change_reason": null
    }
  ],
  "modules": [
    "release",
    "packaging",
    "apps/api/storylens-api.spec"
  ],
  "files": [
    "release/changes/CHG-20260727-021.json",
    "VERSION"
  ],
  "user_summary": "将 CHG-013 节奏适配配置修复纳入 1.1.1，构建并验证 1.1.1-rc.1 安装包",
  "technical_summary": "Packaged StoryLens 1.1.1-rc.1 including verified CHG-013. Sidecar/Installer build count 1. Zero provider. Formal AppData untouched. Awaiting manual installed acceptance before verified.",
  "acceptance_criteria": [
    "Installer StoryLens_1.1.1-rc.1_x64-setup.exe; SIDECAR/INSTALLER build count 1; config packaging hash identity; CWD independence 6/6; isolated re-finalize fits; zero provider; zero formal AppData writes; security audit PASS; CHG-013 remains verified",
    "RC1 installed acceptance PASSED; proceed to formal 1.1.1"
  ],
  "tests": [
    "CHG-013 targeted pytest + packaging/CWD/refinalize gates",
    "release regression vitest/typecheck",
    "targeted pytest 80 passed",
    "targeted vitest 83 passed",
    "typecheck PASS",
    "config packaging + CWD 6/6 + isolated refinalize"
  ],
  "verification_evidence": [
    "release/evidence/1.1.1-rc.1/",
    "release/evidence/1.1.1-rc.1/FINAL_REPORT.md",
    "release/evidence/1.1.1-rc.1/PREBUILD_GATE.md",
    "release/evidence/1.1.1-rc.1/BUILD_MANIFEST.json",
    "release/evidence/1.1.1-rc.1/SIDECAR_IDENTITY.json",
    "release/evidence/1.1.1-rc.1/CONFIG_PACKAGING.json",
    "release/evidence/1.1.1-rc.1/CWD_INDEPENDENCE.json",
    "release/evidence/1.1.1-rc.1/REFINALIZE_VERIFICATION.json",
    "release/evidence/1.1.1-rc.1/SECURITY_AUDIT.md",
    "release/evidence/1.1.1-rc.1/INSTALLER_AUDIT.md",
    "release/evidence/1.1.1-rc.1/MANUAL_INSTALLED_ACCEPTANCE.md",
    "installer SHA256 DEEB00F87C77...; sidecar 4F7FD23B...; CWD 6/6; isolated refinalize fits 40/90/90/50/80/90/40/80/50",
    "RC1 manual acceptance PASSED (user authorized formal 1.1.1 publish); installer SHA DEEB00F87C77..."
  ],
  "data_compatibility": {
    "database_changed": false,
    "migration_required": false,
    "user_data_compatible": true,
    "notes": "No schema change. pacing_fit may be null when unavailable. No auto rewrite of user DB."
  },
  "release_impact": {
    "requires_reanalysis": false,
    "requires_restart": true,
    "updater_impact": false,
    "breaking_change": false
  },
  "blocker_level": null,
  "head_inclusion": "INCLUDED",
  "created_at": "2026-07-27T08:35:48Z",
  "updated_at": "2026-07-27T12:41:46Z"
}
