{
  "id": "CHG-20260723-006",
  "title": "Simplify Reader Journey workspace information hierarchy",
  "type": "fix",
  "base_version": "1.0.4",
  "status": "tested",
  "include_in_next_release": true,
  "commits": [
    {
      "sha": "4cf755d1e4a10170cec86215c88d92039d2ca90f",
      "message": "fix: simplify reader journey workspace information hierarchy",
      "primary": true,
      "multi_change_reason": null
    },
    {
      "sha": "2318ff78454a2ba8d489ca5a19b0d7929ea0d977",
      "message": "docs: mark CHG-20260723-006 tested for hierarchy simplification",
      "primary": false,
      "multi_change_reason": "registry status for CHG-20260723-006"
    },
    {
      "sha": "78601b2e969f131866ece52290101c834caa7ecf",
      "message": "fix: finish Reader Journey hierarchy copy, phases, legend placement (CHG-20260723-006).",
      "primary": true,
      "multi_change_reason": null
    },
    {
      "sha": "ec14b4c45f98e21c7b7ef9448f500e0cf946124a",
      "message": "docs: sync CHG-20260723-006 registry after hierarchy finish.",
      "primary": false,
      "multi_change_reason": "registry status for CHG-20260723-006 finish"
    },
    {
      "sha": "978d2b66ff8ec33b32e63fc8644ea8ac66e46bee",
      "message": "fix: unify Reader Journey topbar lenses with detail/compare actions (CHG-20260723-006).",
      "primary": true,
      "multi_change_reason": null
    },
    {
      "sha": "6de850198590a5ee01aa4000f1c975029897aa6b",
      "message": "docs: sync CHG-20260723-006 registry after unified topbar.",
      "primary": false,
      "multi_change_reason": "registry status for unified topbar"
    }
  ],
  "modules": [
    "desktop"
  ],
  "files": [
    "apps/desktop/src/components/readerJourney/ReaderJourneyWorkspace.tsx",
    "apps/desktop/src/components/readerJourney/JourneyChartToolbar.tsx",
    "apps/desktop/src/components/readerJourney/JourneyLensExplanationChrome.tsx",
    "apps/desktop/src/components/readerJourney/readerJourney.css",
    "apps/desktop/src/components/readerJourney/hierarchySimplification_local.test.tsx",
    "apps/desktop/src/components/readerJourney/readerJourneyLensExplanation.ts",
    "apps/desktop/src/components/readerJourney/CanonicalJourneyChart.tsx",
    "apps/desktop/src/components/readerJourney/readerJourneyLensExplanation.test.tsx",
    "apps/desktop/src/components/readerJourney/JourneyComparisonTools.tsx",
    "apps/desktop/src/components/readerJourney/observationLenses.ts",
    "apps/desktop/src/components/readerJourney/compareWithUrl_local.test.tsx",
    "apps/desktop/src/components/readerJourney/observation_lens_selector_inline_local.test.tsx",
    "apps/desktop/src/hooks/useJourneySelection.ts",
    "apps/desktop/src/components/readerJourney/ReaderJourneySyncWorkspace.tsx",
    "apps/desktop/src/components/readerJourney/lensClickRace_local.test.tsx"
  ],
  "user_summary": "修复六个 Lens 首次单击弹回：URL 单一可信源，lens/metric 原子更新，消除父级 syncUrl 竞态。",
  "technical_summary": "Root cause: useJourneySelection.syncUrl used stale searchParams and overwrote Workspace lens write. Fix: functional syncUrl + skip URL rewrite on journey_rhythm; resolveJourneyLensFromSearch prefers lens; normalize conflicting metric once.",
  "acceptance_criteria": [
    "No 精简/完整标记 or top 分析信息 button",
    "No top V2/chapter summary banner",
    "Lens selected state clearly visible",
    "No 怎么看 gray panel",
    "Single unified legend",
    "No bottom chapter summary strip",
    "Six lens one-liners from unified explanation config",
    "Hook payoff lens hides empty phase cards",
    "Single legend centered above curve after phases",
    "Lens + 收起详情 + 对比分析 same topbar row",
    "No 更多操作 in ordinary RJ UI",
    "Compare exit stays on topbar right; hook_payoff hides compare",
    "Single named lens explanation only",
    "Single click selects lens and keeps it",
    "Atomic lens+metric URL write; no stale parent syncUrl overwrite"
  ],
  "tests": [
    "apps/desktop/src/components/readerJourney/hierarchySimplification_local.test.tsx",
    "apps/desktop/src/components/readerJourney/ReaderJourneyWorkspace.test.tsx",
    "apps/desktop/src/components/readerJourney/readerJourneyLensExplanation.test.tsx",
    "apps/desktop/src/components/readerJourney/compareWithUrl_local.test.tsx",
    "apps/desktop/src/components/readerJourney/observation_lens_selector_inline_local.test.tsx",
    "apps/desktop/src/components/readerJourney/lensClickRace_local.test.tsx"
  ],
  "verification_evidence": [
    "Local Vitest hierarchy/workspace/lens/compare passed; typecheck; lint; version/registry/diff checks.",
    "Local Vitest hierarchy/workspace/lens explanation passed; typecheck; lint; VERSION 1.0.4; registry check",
    "Unified topbar Vitest 42 passed; typecheck; lint; VERSION 1.0.4",
    "Lens click race Vitest passed; typecheck; lint; VERSION 1.0.4"
  ],
  "data_compatibility": {
    "database_changed": false,
    "migration_required": false,
    "user_data_compatible": true,
    "notes": "Presentation-only; no algorithm/artifact changes."
  },
  "release_impact": {
    "requires_reanalysis": false,
    "requires_restart": false,
    "updater_impact": false,
    "breaking_change": false
  },
  "blocker_level": "P1",
  "head_inclusion": "INCLUDED",
  "created_at": "2026-07-23T03:06:52Z",
  "updated_at": "2026-07-23T03:57:14Z"
}
