{
  "id": "CHG-20260721-007",
  "title": "变更登记池与下一版本发布汇总机制",
  "type": "build",
  "base_version": "1.0.2",
  "status": "ready",
  "include_in_next_release": true,
  "commits": [
    {
      "sha": "4e656f1ca7ec4b5abc6d2780b73a2c5bc800c080",
      "message": "Add StoryLens change registry and release aggregation",
      "primary": true,
      "multi_change_reason": null
    },
    {
      "sha": "89eb36bd6fa87092ba2e25b01bc9aaa4207860a0",
      "message": "Add ready-for-staging and legacy baseline adoption gates",
      "primary": true,
      "multi_change_reason": null
    }
  ],
  "modules": [
    "scripts",
    "release",
    "docs",
    ".cursor/rules"
  ],
  "files": [],
  "user_summary": "建立功能变更登记池、发布基线与下一版本自动汇总门禁",
  "technical_summary": "新增 change_registry.py、release 基线/变更池、Cursor 规则、文档与 check_project/release-guard 接入。",
  "acceptance_criteria": [
    "日常可登记变更且不升版",
    "正式发布前必须 freeze + ready",
    "未登记源码 commit 阻止发布"
  ],
  "tests": [
    "apps/api/tests/test_change_registry.py",
    "apps/api/tests/test_change_registry.py (10 passed locally)"
  ],
  "verification_evidence": [
    "change_registry tests passed including ready-for-staging and adopt-legacy; unregistered empty after attach"
  ],
  "data_compatibility": {
    "database_changed": false,
    "migration_required": false,
    "user_data_compatible": true,
    "notes": ""
  },
  "release_impact": {
    "requires_reanalysis": false,
    "requires_restart": false,
    "updater_impact": false,
    "breaking_change": false
  },
  "blocker_level": null,
  "head_inclusion": "INCLUDED",
  "created_at": "2026-07-21T06:02:51Z",
  "updated_at": "2026-07-21T06:46:58Z"
}
