{
  "id": "CHG-20260728-012",
  "title": "WB-1.5 Narrative Asset Evidence Materialization",
  "type": "feature",
  "base_version": "1.1.1",
  "status": "tested",
  "include_in_next_release": true,
  "commits": [
    {
      "sha": "941e5d855d10229fa5a7965203587aaf52c52afb",
      "message": "feat(whole-book): materialize narrative assets and evidence — CHG-012 WB-1.5",
      "primary": true,
      "multi_change_reason": null
    },
    {
      "sha": "122879e022b675532922e49bf7532822ec19670b",
      "message": "fix(whole-book): harden Wave C merge, relations, and evidence reports",
      "primary": false,
      "multi_change_reason": "merge/relation hardening after Sample S verification"
    }
  ],
  "modules": [],
  "files": [],
  "user_summary": "Conservative cross-window merge and narrative entity/asset/evidence/relation materialization.",
  "technical_summary": "",
  "acceptance_criteria": [],
  "tests": [
    "apps/api/tests/test_whole_book_wb15_materialization.py"
  ],
  "verification_evidence": [
    "release/evidence/whole-book/WB-1.5/FINAL_REPORT.md",
    "release/evidence/whole-book/WB-1.5/TEST_RESULTS.md"
  ],
  "data_compatibility": {
    "database_changed": false,
    "migration_required": false,
    "user_data_compatible": true,
    "notes": ""
  },
  "release_impact": {
    "requires_reanalysis": false,
    "requires_restart": false,
    "updater_impact": false,
    "breaking_change": false
  },
  "blocker_level": null,
  "head_inclusion": "INCLUDED",
  "created_at": "2026-07-28T05:02:31Z",
  "updated_at": "2026-07-28T05:39:47Z"
}
